{
   "logLevel": "info",
   "controlWindowWidth": 1024,
   "controlWindowHeight": 768,
   "windowTitle": "Project-WGX 绘图输出窗口",
   "windowWidth": 1024,
   "windowHeight": 1024,
   "renderMode": "vulkan",
   "vulkanConfig": {
      "physicalDeviceID": 0,
      "validationLayers": true,
      "vsync": 1,
      "enableMSAA": false,
      "msaaSampleCount": 4,
      "enableAnisotropy": false,
      "anisotropyLevel": 1.0,
      "forceUNORM": false
   },
   "gles2Config": {
      "enableMSAA": true,
      "enableLineSmooth": true
   },
   "pluginConfigs": {}
}
